{
  "$schema": "http://json-schema.org/draft-07/schema#",
  "$id": "https://github.com/career-ops-aihawk-bridge/schemas/aihawk-queue.schema.json",
  "title": "AIHawk Queue",
  "description": "Handoff format between career-ops (stage 1: evaluate) and AIHawk (stage 2: apply). Produced by export-aihawk.mjs, consumed by bridge.py.",
  "type": "object",
  "required": ["schema_version", "exported_at", "jobs"],
  "properties": {
    "schema_version": {
      "type": "string",
      "description": "Schema version. Increment when breaking changes are made.",
      "const": "1.0"
    },
    "exported_at": {
      "type": "string",
      "format": "date-time",
      "description": "ISO 8601 timestamp when this queue was generated."
    },
    "score_threshold": {
      "type": "number",
      "description": "Minimum score used to filter jobs into this queue.",
      "minimum": 0,
      "maximum": 5
    },
    "status_filter": {
      "type": "array",
      "items": { "type": "string" },
      "description": "career-ops statuses that were included in the filter."
    },
    "career_ops_dir": {
      "type": "string",
      "description": "Absolute path to the career-ops repo on disk. Used by bridge.py to locate PDFs and reports."
    },
    "jobs": {
      "type": "array",
      "description": "Approved jobs ready for AIHawk submission.",
      "items": {
        "type": "object",
        "required": ["id", "company", "role", "score", "status"],
        "properties": {
          "id": {
            "type": "string",
            "description": "Zero-padded 3-digit sequential ID from career-ops tracker.",
            "pattern": "^[0-9]{3}$",
            "examples": ["042", "137"]
          },
          "date": {
            "type": "string",
            "format": "date",
            "description": "Date the offer was evaluated (YYYY-MM-DD)."
          },
          "company": {
            "type": "string",
            "description": "Company name as it appears in career-ops tracker."
          },
          "role": {
            "type": "string",
            "description": "Job title / role name."
          },
          "score": {
            "type": "number",
            "description": "career-ops evaluation score (0.0–5.0).",
            "minimum": 0,
            "maximum": 5
          },
          "status": {
            "type": "string",
            "description": "career-ops canonical status at export time.",
            "enum": ["Evaluated", "Applied", "Responded", "Interview", "Offer", "Rejected", "Discarded", "SKIP"]
          },
          "hasPdf": {
            "type": "boolean",
            "description": "Whether a tailored PDF resume was generated by career-ops."
          },
          "pdfPath": {
            "type": ["string", "null"],
            "description": "Absolute path to the tailored PDF resume on disk. null if not found."
          },
          "reportPath": {
            "type": ["string", "null"],
            "description": "Absolute path to the career-ops evaluation report (.md). null if not found."
          },
          "jobUrl": {
            "type": ["string", "null"],
            "format": "uri",
            "description": "Direct URL to the job posting. Extracted from the **URL:** field in the report. null if not found."
          },
          "notes": {
            "type": "string",
            "description": "One-line notes from the career-ops tracker."
          }
        },
        "additionalProperties": false
      }
    }
  },
  "additionalProperties": false
}
